{
  "schema": "cppro-skin",
  "version": 1,
  "id": "moodfield",
  "name": "Moodfield",
  "build_id": "MOODFIELD-1",
  "canvas": {
    "width": 1920,
    "height": 550
  },
  "layout": "../../../layout/cppro-key-layout-v1.json",
  "theme": "theme.json",
  "profile": "profile.json",
  "states": {
    "initial": "live",
    "allowed": ["live"]
  },
  "effects": {
    "key_lights": {
      "pool_size": 68
    },
    "release_pad": {
      "pool_size": 68,
      "hold_cap_ms": 750,
      "duration_ms": 400
    },
    "wave": {
      "pool_size": 204,
      "radii_px": [24, 58, 96],
      "stage_ms": [80, 120, 180],
      "opacity": [0.34, 0.20, 0.10]
    }
  }
}
