{
  "schema": "cppro-skin",
  "version": 1,
  "id": "koi-pond",
  "name": "Koi Pond Physics Sandbox",
  "build_id": "KOI-POND-1",
  "canvas": {
    "width": 1920,
    "height": 550
  },
  "layout": "../../../layout/cppro-key-layout-v1.json",
  "theme": "theme.json",
  "profile": "profile.json",
  "states": {
    "initial": "live",
    "allowed": ["live"]
  },
  "effects": {
    "key_lights": {
      "pool_size": 68
    },
    "release_pad": {
      "pool_size": 68,
      "hold_cap_ms": 750,
      "duration_ms": 400
    },
    "wave": {
      "pool_size": 204,
      "radii_px": [31, 53, 79],
      "stage_ms": [70, 90, 130],
      "opacity": [0.64, 0.38, 0.18]
    }
  }
}
