{
  "schema": "cppro-skin",
  "version": 1,
  "id": "keyfield-a2",
  "name": "Keyfield A2 App Shell",
  "build_id": "KF-A2",
  "canvas": {
    "width": 1920,
    "height": 550
  },
  "layout": "../../../layout/cppro-key-layout-v1.json",
  "theme": "theme.json",
  "profile": "profile.json",
  "states": {
    "initial": "ready",
    "allowed": ["ready", "live", "paused"]
  },
  "effects": {
    "key_lights": {
      "pool_size": 68
    },
    "release_pad": {
      "pool_size": 68,
      "hold_cap_ms": 750,
      "duration_ms": 400
    },
    "wave": {
      "pool_size": 204,
      "radii_px": [18, 46, 82],
      "stage_ms": [70, 90, 130],
      "opacity": [0.46, 0.28, 0.14]
    }
  }
}
